{
  "schema": "omakase-ee-provider/1",
  "id": "d1-firmware.end-effector.leadshine.dh116",
  "version": "0.2.0",
  "package": {
    "name": "d1-ee-leadshine-dh116",
    "arch": "arm64",
    "plane": "apt"
  },
  "sdk": {
    "contract": "end_effector.shm/1",
    "d1_ee_sdk": ">=0.1.0, <0.2.0"
  },
  "launch": {
    "command": "/opt/d1-ee-leadshine-dh116/bin/d1-ee-leadshine-dh116-provider --side {side}"
  },
  "models": [
    {
      "model": "leadshine/dh116s",
      "driver": "leadshine-dh116s",
      "links": [
        "flange"
      ],
      "joints": 6,
      "postures": {
        "open": [
          0.0,
          0.0,
          0.0,
          0.0,
          0.0,
          0.0
        ],
        "closed": [
          1.0,
          1.0,
          1.0,
          1.0,
          1.0,
          1.0
        ]
      }
    }
  ],
  "guard_models": [],
  "calibration": {
    "required": false
  },
  "conformance": {
    "harness": "d1fw-ee-harness",
    "version": "0.1.0",
    "run_url": "https://github.com/Omakase-Robotics-Org/d1-ee-leadshine-dh116/actions/runs/39177092357"
  }
}
